<?xml version="1.0" encoding="UTF-8"?>
<MailConfiguration Subject="Covid-19 Orders" Sender="s.heinlein@phoenixgroup.eu" SMTPServer="denu00smtpint.phoenix.loc" xsi:noNamespaceSchemaLocation="MailConfiguration.xsd" xmlns:xsi="http://www.w3.org/2001/XMLSchema-instance">
	<Body>
Hallo zusammen,

im Anhang findet ihr die neuesten Covid-19-Auftragsdaten.	

Viele Grüße	
	</Body>
	<Recipients>
		<Recipient>b.bischof@phoenixgroup.eu</Recipient>				
		<Recipient>d.zdjelar@phoenixgroup.eu</Recipient>		
		<Recipient>s.heinlein@phoenixgroup.eu</Recipient>		
		<Recipient>i.einig@myphoenix.at</Recipient>		
		<Recipient>cid.bestellung@myphoenix.at</Recipient>		
		<Recipient>j.jerson@myphoenix.at</Recipient>		
		<!--<Recipient>g.strouhal@myphoenix.at</Recipient>		
		<Recipient>m.volk@myphoenix.at</Recipient>
		<Recipient>b.bergmann-necker@myphoenix.at</Recipient>-->
	</Recipients>
</MailConfiguration>
